reviewText,reviewDate,authorName
a good product. Value for money you should buy it ğŸ™ğŸ»,09 Jan 2025,Sandip D.Verified Purchase
Good enough for 48 rupees,30 Dec 2024,Deepak C.Verified Purchase
à¤¬à¤šà¥à¤šà¤¾à¤•à¥‹ à¤°à¤¹à¥‡à¤•à¥‹ à¤° à¤›,5 days ago,tmgpakhrinbijayVerified Purchase
Looks exactly as shown in picture . doesn't have weight adjustment setting but good for beginners .,2 days ago,H***iVerified Purchase
"picture ma dekhaye KO jasto xaina.
so I don't recommend this one",19 Dec 2024,A***yVerified Purchase
